{
  "publication": {
    "pmid": 10871299,
    "citation": "Obach RS. Inhibition of human cytochrome P450 enzymes by constituents of St. John's Wort, an herbal preparation used in the treatment of depression. J Pharmacol Exp Ther. 2000;294(1):88-95."
  },
  "remedies": [
    {
      "id": 0,
      "name": "St John's wort",
      "xrefs": [
        "ITIS:21454"
      ]
    }
  ],
  "drugs": [],
  "compounds": [],
  "enzymes": [],
  "transporter": [],
  "remedy-compounds": [],
  "drug-compounds": [],
  "processes": [],
  "studies": []
}
